Article_Headline,Article_url,Article_content,Article_Author,COVID Related?
"452 suicides reported in Singapore in 2020 amid Covid-19, highest since 2012",https://www.straitstimes.com/singapore/452-suicides-reported-in-singapore-in-2020-amid-covid-19-highest-since-2012,"SINGAPORE - A total of 452 suicides were reported in Singapore last year, the highest figure since 2012.
In a statement on Thursday (July 8), non-profit suicide prevention centre Samaritans of Singapore (SOS) said this was a 13 per cent increase from 2019's 400 cases.
It added that the increase in suicide deaths was observed across all age groups. In particular, the number of suicide deaths among the elderly - aged 60 and above - hit 154, the highest recorded figure among this age group since 1991 and a 26 per cent increase from 2019.
SOS chief executive Gasper Tan said: ""Covid-19 has severely affected the nation's economy, lifestyle and mental health. We are extremely worried about how our elderly are coping during this public health crisis.
""During the pandemic period, the elderly were more likely to face social isolation and financial worries. Difficulty in constantly adapting to changes as well as prolonged feelings of loneliness may be devastating.""
While there was an increase in suicide deaths among the elderly in 2020 compared with 2019, SOS said its 24-hour hotline received fewer calls from them.
In its 2020 financial year from April 2020 to March 2021, 4,455 calls were made by the elderly, compared with 4,816 in the 2019 financial year.
SOS added that elderly callers expressed difficulty coping with loneliness and inactivity due to isolation, psychological distress, and impaired social and family relationships - which were compounded by the pandemic.
The Institute of Mental Health's clinical director in the Office of Population Health, Adjunct Associate Professor Lee Cheng, said that the elderly who are living alone may lack support to deal with the pandemic.
""Those who are used to attending social activities outside on a regular basis will also likely feel socially isolated during this period,"" he added.
Said SOS' Mr Tan: ""Since the pandemic, many in-person activities and initiatives for the elderly have moved digitally. Those with limited proficiency with technology may find themselves lost and helpless.
He added that given the uncertainty of how long more the pandemic will last, it is important to build on existing efforts and find new ways to support the mental health of the elderly.
More on this topic
Spike in calls to suicide prevention agency SOS in 2020 as more in distress amid Covid-19
Don't be afraid to ask for help, says mother who contemplated suicide
Singapore University of Social Sciences' Associate Professor Helen Ko said it was important to find as many ways as possible to connect with the elderly who are lonely and socially isolated.
""Very often, most elderly persons want to hear a human voice and they long to hear the familiar voice of a loved one,"" she said.
""For those who are not digitally savvy, please be very patient as they may need more time to pick up digital skills.""
From July 26, those who need emotional support may call SOS at its new four-digit hotline at 1-767. SOS said the shortened hotline will help make seeking help more convenient.
The old hotline number, 1800-221-4444, will remain operational even after the four-digit hotline is launched, and both numbers will be toll-free.
Helplines
Samaritans of Singapore: 1-767 (24 hours)
Institute of Mental Health: 6389-2222 (24 hours)
Singapore Association for Mental Health: 1800 283-7019 (Mon to Fri, 9am to 6pm)
TOUCHline: 1800 377-2252 (Mon to Fri, 9am to 6pm)
Care Corner (Mandarin hotline): 1800-3535-800 (Daily, 10am to 10pm)
More on this topic
Mental wellness an important issue amid Covid-19 pandemic: Shanmugam
How to keep calm and carry on amid the pandemic",Ng Keng Gene,TRUE
Malaysia sees rise in suicides and calls to helplines amid Covid-19 pandemic,https://www.straitstimes.com/asia/se-asia/malaysia-sees-rise-in-suicides-and-calls-to-helplines-amid-covid-19-pandemic,"KUALA LUMPUR - Having been diagnosed with depression since she was a teenager, online retailer Nina Razif, 35, had learnt to cope with it over the years - or so she thought.
Being under Malaysia's first two lockdowns after the pandemic started last year did not affect her mental health, but by the time the third one was imposed last month, Madam Nina's feelings of stress and depression began to overwhelm her.
""I started feeling really depressed and helpless when I saw more and more people, including some I know, suffering. And I can't do much about it,"" she told The Straits Times.
During the lockdown, a friend attempted to take his life but she managed to reach him in time.
""This shook me to the core because years ago, I lost a close friend to suicide and it also brought me back to the time when I tried to take my own life,"" she said.
""I'm burnt out, and it's almost impossible to juggle parenting, work, school and taking care of my differently-abled child. And for the first time in my life, I'm tired of staying at home. I've been a good citizen but why are cases still increasing?""
Madam Nina is not alone.
The police recorded 468 suicides in the first five months of 2021, compared to 631 in 2020, and 609 in 2019. The three main causes cited were family problems, emotional pressure and finances.
Emotional support help centre Befrienders Kuala Lumpur recorded 20,575 calls from January to June this year, compared to 32,710 for the whole of last year, its publicity director Ardy Ayadali told ST.
When the first lockdown began in March last year, lasting until June, some 9,754 calls were received. This year, a total of 14,136 calls were made to the Befrienders during the same period, marking a 45 per cent surge.
The centre said the main problems the callers faced were issues relating to mental health, relationships and family.
It has also seen an increase in calls related to financial and job-related issues over the past two months.
Malaysia has recorded nearly 800,000 coronavirus cases since the pandemic began, with some 7,000 daily new cases over the last few days.
The country is under a nationwide lockdown until the number of daily cases dips below 4,000.
While six states have had some restrictions eased this week, much of Klang Valley has been placed under the strictest form of lockdown due to a persistently high number of infections.
Dr Ng Yin Ping, a consultant psychiatrist from Pantai Hospital, Penang, said that she is seeing more patients with symptoms of increased stress, such as insomnia, anxiety, irritability and low mood, which may affect their daily functioning.
More on this topic
Malaysians talk of mental anguish as Covid-19 lockdown is extended
People prepare for a tough time during full Covid-19 lockdown in Malaysia
""Contributing factors include work stress or academic stress. Many are required to work from home so some may have difficulties focusing at home due to an unsuitable or noisy home environment.""
Economic uncertainty, loneliness, fear of visiting health facilities due to the risk of infection, and the loss of one's usual coping mechanisms such as socialising, group sports and travelling also contribute to mental health problems, said Dr Ng.
The government needs to incorporate suicide prevention in its lockdown plans, the Consumers' Association of Penang (CAP) said.
""Never have Malaysians witnessed the despair of so many jobless, hungry and homeless people, having to depend on soup kitchens for their meals,"" CAP president Mohideen Abdul Kader was quoted as saying by The New Straits Times on July 1.
""Such a situation causes despair and hopelessness, besides the feeling of loneliness during the pandemic.""
Government aid was insufficient as some may have already depleted their life savings and were jobless, he said.
Shops are closed following a lockdown imposed due to the movement control order at a business area in Kuala Lumpur on July 2, 2021. PHOTO: EPA-EFE
While the number of people with mental health issues is rising, Malaysia is also grappling with a shortage of psychiatrists.
Health Minister Adham Baba on Tuesday (July 6) revealed that Malaysia's psychiatrist-to-patient ratio was only a tenth of the one per 10,000 recommended by the World Health Organisation (WHO).
There are a total of 400 psychiatrists in Malaysia, when there should be 3,100.
Dr Ng's advice for those who find it difficult to cope during the pandemic is to reach out to family and friends, or to call helplines or see mental health professionals for help.
""Stay connected with people, via video or phone calls. Remember to eat balanced meals, exercise and have adequate rest and sleep. Exercise caution when it comes to receiving or sharing information on social media as some news may be triggering or even harmful to your mental health.
""Finally, be kind to yourself. It's okay to not be okay, and to seek help from mental health professionals,"" she said.
More on this topic
Malaysian business groups warn of mass unemployment as Covid-19 lockdown stretches on
Malaysian police and opposition MP help the hungry in Johor Bahru
Helplines
Samaritans Of Singapore: 1800-221-4444
Singapore Association For Mental Health: 1800-283-7019
Institute Of Mental Health: 6389-2222
Care Corner Counselling Centre (Mandarin): 1800-353-5800
Tinkle Friend: 1800-274-4788
Related Stories:
S'pore to allow up to 5 to dine in from July 12, gathering size may go up to 8 at end-July
S'pore's Covid-19 rules from July 12: 9 things you need to know
Covid-19 curbs in Seoul may be raised to highest level as new cases surge
Indonesia expands nationwide Covid-19 curbs
Made-in-Malaysia Covid-19 vaccine expected to be ready in 2024
Israel sees decline in Pfizer Covid-19 vaccine efficacy rate due to Delta variant
Moving from Covid-19 pandemic to endemic: Singapore's strategy and how it can unfold
Covid-19 cases climb in Thailand as it opens up less-affected Phuket to tourists
MOH to stop giving details of Covid-19 community cases",Hazlin Hassan,TRUE
Singapore residents exercising more and eating healthier now compared with last year: Poll,https://www.straitstimes.com/singapore/health/singapore-residents-feel-healthier-than-last-year-but-mental-health-has-taken-a-hit,"SINGAPORE - People here are exercising more and eating healthier now compared with last year, with about three in four saying physical health is ""very much"" a priority.
But nearly 25 per cent said their mental health has suffered, with money woes being the top reason for anxiety and depression, a recent poll has found.
An online survey of 1,000 Singapore residents aged between 18 and 70 found that 44 per cent felt physically healthier now than before the Covid-19 outbreak.
Sixty-six per cent of respondents reported higher motivation to adopt healthy lifestyles, said communications firm Wunderman Thompson in a report on Monday (July 5).
However, work commitments can get in the way.
Despite their motivation level, 61 per cent reported living more sedentary lives.
The poll found that 46 per cent of respondents reported longer working hours, and 73 per cent said they spend more time in front of their screens.
After money, stress about work and the impact from Covid-19 were the factors that affected mental health most, respondents said.
""Most worryingly, 39 per cent say they have considered suicide at some point, with 5 per cent saying they think of it every day and 8 per cent once or twice a week. Unemployed people were most likely to consider suicide every day or once or twice a week,"" the report said.
At a virtual press conference last Friday (July 2), Ms Malati Afridi, co-author of the study, said 48 per cent of people under 35 had considered suicide at least once in the past year, while the rate was 50 per cent for those with children under the age of six.
The study examined Covid-19's impacts on physical and mental health, as well as relationships and health inequities.
Although nearly a quarter of respondents reported suffering from anxiety and depression in the past year, 68 per cent believe there is a stigma against mental health issues in Singapore.
More than 65 per cent would avoid the topic with their family, even when there is an issue.
Dr Shawn Ee, director of The Psychology Practice, said this decline in mental health was not surprising.
He added: ""Covid-19 is an abnormal event that interrupts our way of life. Any major lifestyle change that removes a coping strategy for stress, can tip someone over into feeling trapped. For example, avid gym goers would struggle when gyms are closed.""
Covid-19's impacts have also carried over to family relationships, with 49 per cent of respondents agreeing that family stress has increased over the past year.
More on this topic
One year after S'pore's circuit breaker, people socialising less, working more
More needed help during Covid-19 pandemic, say mental health experts
Inequities have also become more pronounced, across markers of gender, education levels, employment status and income.
Women reported feeling less healthy than men, both physically and mentally. The study cited a possible reason as women being more likely to juggle paid work with childcare or eldercare.
Individuals in the highest income bracket (earning $75,000 and above a year) and education level (having post-graduate qualifications) also reported more satisfaction with both physical and mental health.
Mr Gasper Tan, chief executive of Samaritans of Singapore, a suicide prevention centre, said one common anxiety cited by callers to their mental health helpline was uncertainty of the future due to financial insecurity and unemployment.
To cope with such struggles, Mr Tan advised: ""It could be helpful to talk to someone by letting trusted family or friends know what they are going through.
""Having a listening ear can provide relief and assurance that they do not have to go through this difficult period alone.""
More on this topic
Covid-19 pandemic brought women's mental health needs to the forefront: Muslim women's association
Moving from Covid-19 pandemic to endemic: Singapore's strategy and how it can unfold
Helplines
National Care Hotline: 1800-202-6868
Institute of Mental Health's Mental Health Helpline: 6389-2222
Samaritans of Singapore: 1800-221-4444
Touchline: 1800-377-2252
Care Corner Counselling Centre: 6353-1180
Related Stories:
S'pore to allow up to 5 to dine in from July 12, gathering size may go up to 8 at end-July
S'pore's Covid-19 rules from July 12: 9 things you need to know
Covid-19 curbs in Seoul may be raised to highest level as new cases surge
Indonesia expands nationwide Covid-19 curbs
Made-in-Malaysia Covid-19 vaccine expected to be ready in 2024
Israel sees decline in Pfizer Covid-19 vaccine efficacy rate due to Delta variant
Moving from Covid-19 pandemic to endemic: Singapore's strategy and how it can unfold
Covid-19 cases climb in Thailand as it opens up less-affected Phuket to tourists
MOH to stop giving details of Covid-19 community cases",Eleanor Katharine Yeo,TRUE
"Tennis: Osaka says preparing for Olympics, will do news conferences",https://www.straitstimes.com/sport/tennis/tennis-osaka-says-preparing-for-olympics-will-do-news-conferences,"TOKYO (AFP) - Tennis star Naomi Osaka said on Monday (July 5) she wants to be on top form at the Olympics and will take part in press conferences, after pulling out of several tournaments citing her struggles with depression and anxiety.
The world No. 2 told Japan's national broadcaster NHK she was getting ready to play on home turf at the pandemic-postponed Tokyo Games, after having withdrawn from Wimbledon and the French Open.
""I am preparing myself little by little so I can be at the top of my game for the Olympics,"" the 23-year-old wrote in a message published by the broadcaster.
""Since getting the attention of the world, I've always had bouts of anxiety. This is especially the case in the lead up to big competitions.""
She set off a debate about mental health in June after abandoning her French Open campaign just one match in over a dispute on media duties.
The Japanese player had said post-match news conferences were detrimental to her mental health and likened them to ""kicking people when they're down"".
She later revealed her battle with depression and anxiety in a post on social media, saying she wanted to take time away from the game to get better.
In the message published by NHK, Osaka said she was ""proud"" to play for her country at the Games, adding that she would take part in news conferences while giving consideration to her mental health.
She was fined US$15,000 (S$20,000) and threatened with disqualification from Roland Garros after refusing to honour mandatory media commitments.
French Open organisers protested that they had treated her with ""care and respect"" after they were accused of being heavy-handed.
Osaka's agent said last month that she had withdrawn from Wimbledon to spend time with friends and family.
But he added that she was ""excited to play in front of her home fans"" at Tokyo 2020, which begins on July 23.
More on this topic
In supporting Naomi Osaka, President Halimah highlights the importance of mental health
Naomi Osaka and the power of 'nope'",,TRUE
"Job worries, poor mental health afflict Covid-19-hit British youth",https://www.straitstimes.com/business/economy/job-worries-poor-mental-health-afflict-pandemic-hit-uk-youth,"LONDON (BLOOMBERG) - Young people in Britain are emerging from the coronavirus crisis blighted by poor mental health and worried about their financial future, reports published on Monday (July 5) warned.
The separate analyses, by the Institute for Fiscal Studies (IFS) and the Resolution Foundation, underscore the huge challenges facing millions in their late teens and early 20s as the country returns to normality after more than a year of lockdowns to fight the pandemic.
Those restrictions hit the young harder than other age groups. With government support programmes coming to an end, they are now in danger of permanent damage to their prospects unless policymakers make helping them back to work a top priority, the research groups said.
""Without effective support, there is a risk that young people today will bear the scars of the recession for years to come,"" said IFS senior research economist Xiaowei Xu.
The IFS study found that 19 to 24-year olds were particularly vulnerable to the winding down of furlough wage subsidies, which have saved the vast majority of jobs affected during the pandemic.
Young people, many of whom were forced to move back into the family home, report being more pessimistic about their immediate financial future than other age groups.
The Resolution Foundation said that one in four people aged 18 to 24 are afraid that poor mental health will affect their ability to find a job in future.
Of those placed on furlough, reduced pay or made unemployed, almost 30 per cent say they are experiencing adverse mental effects, according to its survey, which uses new YouGov data.
""Where someone is struggling with their mental health, making the essential first step into the job market can prove impossible, especially in a job market as challenging as the one facing young people,"" said Health Foundation's policy and engagement manager Martina Kane. The Health Foundation supported the survey.
More on this topic
Work-from-home boom risks loss of 6 million UK professional jobs
Working from home in the UK holds back pay and promotions",,TRUE
Voices of Youth: Make the classroom a more inclusive space for neurodivergent students,https://www.straitstimes.com/opinion/forum/voices-of-youth-make-the-classroom-a-more-inclusive-space-for-neurodivergent-students,"Nowadays, Singaporeans are fortunate enough to have a greater awareness of neurodivergent individuals, people whose brains essentially function differently from neurotypical individuals.
This awareness has also led to a better understanding of those with conditions such as attention deficit hyperactivity disorder (ADHD), autism spectrum disorder and dyslexia.
Despite this progress, Singapore can do better to accommodate neurodivergent students in classroom environments, to ensure that their learning is as fruitful and comfortable as that of everyone else.
For instance, allowing students short breaks in between lessons may help students with ADHD, who may struggle to pay attention for long periods of time. Also, as many neurodivergent students may suffer from sensory overload, allowing students to step out of the classroom whenever they need to can benefit their overall learning experience.
The people around them can also make the classroom a more inclusive space through their daily actions.
As a neurodivergent individual myself, I know that we may sometimes behave differently from neurotypical people.
But we go to school for the same reasons as everyone else - to learn and make friends.
Instead of judging us, students can learn to be patient and more accepting by talking to us and learning more about our conditions.
Through clear communication, students will be able to understand their neurodivergent peers better and can better accommodate their needs.
Ultimately, the classroom should be a safe space for all students. Through fostering an understanding environment, all students can understand one another better and not only get along, but also thrive together.
Kooi Xiu Min, 18
JC2 student",,TRUE
