Article_Headline,Article_url,Article_content,Article_Author,COVID Related?
"Athletes don't wear capes, they're human and hurt",https://www.straitstimes.com/sport/athletes-dont-wear-capes-theyre-human-and-hurt,"SINGAPORE - Pull a hair from your head, hold it to the light and study how fine it is. Then consider this. In sport, the margin between distress and validation, between anxiety and satisfaction, can be as thin as that.
In a shooting range, a year's work can be decided by 0.1 or 0.2 of a point. Adele Tan knows this. In three trials - for the SEA Games in 2017 and Commonwealth and Asian Games in 2018 - she missed selection by roughly that whisker.
Please subscribe or log in to continue reading the full article.
Get unlimited access to all stories at $0.99/month
Latest headlines and exclusive stories
In-depth analyses and award-winning multimedia content
Get access to all with our no-contract promotional package at only $0.99/month for the first 3 months*
Subscribe Now
*Terms and conditions apply",Rohit Brijnath,TRUE
"'When you're thinking about fine-tuning your body, you can't forget your mind'",https://www.straitstimes.com/sport/when-youre-thinking-about-fine-tuning-your-body-you-cant-forget-your-mind,"SINGAPORE - When Quah Ting Wen attended the University of California, Los Angeles between 2010 and 2014, living alone for four years, there were moments when she felt lost and saw the line between positive and negative pressure blurred.
Quah, 28, told The Straits Times: ""I put a lot of pressure on myself and everything I did was with the sole purpose of being a very good student and swimmer to the point that I pushed away everything else that might have been important to me for individual growth.
Please subscribe or log in to continue reading the full article.
Get unlimited access to all stories at $0.99/month
Latest headlines and exclusive stories
In-depth analyses and award-winning multimedia content
Get access to all with our no-contract promotional package at only $0.99/month for the first 3 months*
Subscribe Now
*Terms and conditions apply",David Lee,TRUE
"Ahead of Rare Beauty S'pore launch, Selena Gomez talks mental health, 'impossible beauty standards'",https://www.straitstimes.com/life/style/ahead-of-rare-beauty-spore-launch-selena-gomez-talks-mental-health-impossible-beauty,"SINGAPORE - Actress, singer, producer and now beauty mogul.
Adding new hats to her long list of accomplishments is just another day for Selena Gomez, 29. To quote one of the multi-hyphenate's earlier songs, ""it comes naturally"".
Please subscribe or log in to continue reading the full article.
Get unlimited access to all stories at $0.99/month
Latest headlines and exclusive stories
In-depth analyses and award-winning multimedia content
Get access to all with our no-contract promotional package at only $0.99/month for the first 3 months*
Subscribe Now
*Terms and conditions apply",Amanda Chai,TRUE
Feeling socially rusty? Try a little light gossiping,https://www.straitstimes.com/life/feeling-socially-rusty-try-a-little-light-gossiping,"NEW YORK (NYTIMES) - Go ahead, talk a little trash. Gossip may not be good for you, per se, but it's deeply connected to human nature. And it might just help in navigating a post-pandemic world - at least in a social sense.
Historian Yuval Noah Harari wrote in Sapiens: A Brief History Of Humankind that gossip helped early Homo sapiens form larger and more stable bands. He borrowed the idea from anthropologist Robin Dunbar, who theorised in his 1998 book, Grooming, Gossip, and the Evolution of Language, that language - and, by extension, gossip - replaced grooming, a social-bonding practice still seen among our primate cousins.
In other words, humans needed something that would help them keep up to date with friends and family as they spread out across distances, and networks of Homo sapiens were becoming too large for everyone to effectively groom everyone else.
Or, to put it another way, humans evolved to gossip.
Of course, no one can know exactly why or how our species developed an ability to think, communicate and transmit social information. But the language of social bonding is thought to play a pivotal part in ensuring our survival and later flourishing.
This is not to say there are not extreme downsides to gossip, and that there aren't horribly cruel ways to do it. At worst, it can facilitate xenophobia or bigotry on macro levels, and reinforce stereotypes about perceived ""others"". Even in more-casual social settings, gossip can ruin reputations.
But there are also OK ways to gossip. One of those is gossiping about celebrities or powerful people you don't know.
Celebrity-gossip culture began to flourish in the mid-20th century, eventually mutating into its present form as a social media monolith, because - as we all know - it is entertaining.
Famed celebrity-gossip columnist Perez Hilton acknowledged the innate and, in some ways, aspirational human urge to gossip about celebs.
""Even before social media existed, even before we graduated high school, people used to gossip about the captain of the football team, the head cheerleader,"" he said in an interview. ""We always are drawn to perceived roles of power. It's just human nature. It's curiosity.""
As humanity reenters the realm of in-person socialising, we could all benefit from considering this: How might we gossip better? How do we harness this evolutionary tool to our benefit - to connect with greater kindness and empathy after a year that brought with it so much suffering?
Consider your intention and the possible outcomes
When it comes to sharing a bit of gossip, it can help to run through the five Gatekeepers of Speech, which are interpreted from Buddhist teachings: Is it true? Is it kind? Is it beneficial? Is it necessary? Is it the right time?
Gossip need not fulfill all these criteria to be worth sharing, but it is probably less nasty if it fulfills some of them. Note that just because information may be negative, it doesn't mean that the gossip is. An example of this is the whisper networks that emerged from the #MeToo movement.
Consider your motives
If the gossip is negative and doesn't serve any actionable purpose, keep it to yourself. ""People love new couples. People love babies. It's not all negative,"" Hilton said. ""Of course, train wrecks - people being very messy or sloppy publicly - do get a lot of attention. I won't deny that.""
Consider the merit and the source
Gossiping is bad when it sows uncertainty or confusion. And any piece of gossip loses its merit as civilisation-boosting or as a social lubricant when it's a baldfaced lie, or even something heard through the grapevine that can't be substantiated.
When gossiping, remember to exercise some compassion not just for others but for yourself. Everyone gossips - and everyone makes mistakes in gossiping - and you will too.
Don't beat yourself up for falling prey to evolutionary instincts. The best you can do, on your best day, is be kind, keep it positive and stick to the facts.
More on this topic
One year after S'pore's circuit breaker, people socialising less, working more
Focused and quality family time key to building strong bonds",,TRUE
Tennis: Japan rallies to support Osaka after French Open withdrawal,https://www.straitstimes.com/sport/tennis/tennis-japan-rallies-to-support-osaka-after-french-open-withdrawal,"TOKYO (REUTERS) - Japan joined leading figures in tennis in rallying around Naomi Osaka on Tuesday (June 1) after the world No. 2 withdrew from the French Open in a row about post-match media duties, saying she had been suffering from ""depression"" and ""anxiety"".
One of the biggest names in sport, Osaka stunned the tennis world when she pulled out of the Grand Slam on Monday after being fined and threatened with expulsion for declining to face the media after her first-round match on Sunday.
The four-time Grand Slam champion had last week signalled her intentions to skip her media duties to protect her mental well-being and she returned to Twitter on Monday to announce her withdrawal.
While her original stance had earned the Japanese 23-year-old little backing from her fellow professionals, most saying that dealing with the media was part of the job, her withdrawal triggered a wave of support from around the world.
""The first thing to be considered is Ms Osaka's health. I wish her the earliest possible recovery,"" Japan Tennis Association (JTA) executive director Toshihisa Tsuchihashi said in a statement on Tuesday.
Japan's Chief Cabinet Secretary Katsunobu Kato told a news conference that he would ""watch over her quietly"" and there was concern on the streets of Tokyo for the woman who will be one of the faces of this year's Olympic Games in the city.
""I think she's under a lot of pressure, more than we can imagine,"" kimono dresser Tomomi Noguchi, 67, told Reuters.
""She got to the top when she was young so I think we can't really imagine what she's going through.""
Vickie Skorji, who manages a helpline at TELL, a non-profit counselling service in Japan, said society needed to be ""more respectful and supportive"" of mental health.
""Who has asked her how she is doing? She put out a statement and said 'I need to take care of myself,' and she's been punished,"" Skorji told Reuters.
""I think she is courageous and needs support.""
Skorji's thoughts echoed earlier comments from women's tennis trailblazers Martina Navratilova and Billie Jean King.
""It's incredibly brave that Naomi Osaka has revealed her truth about her struggle with depression,"" King wrote on social media.
""Right now, the important thing is that we give her the space and time she needs. We wish her well.""
Earlier, Williams sisters Serena and Venus, as well as younger American players Coco Gauff and Sloane Stephens, chimed in with messages of support as the focus shifted from Osaka's responsibilities to her well-being.
More on this topic
Tennis: Osaka finds support after decision to skip press at French Open
Tennis: Osaka lets racket do talking at French Open
There were also messages of support posted on social media from athletes in other sports.
""You shouldn't ever have to make a decision like this - but so damn impressive taking the high road when the powers that be don't protect their own. Major respect,"" wrote National Basketball Association All-Star Stephen Curry.
There was some criticism of Roland Garros organisers for their handling of the matter.
French Tennis Federation president Gilles Moretton read a prepared statement on Monday offering Osaka their support but the irony of him not taking questions afterwards was not lost on some.
""So the FFT handled the Ms Osaka mental health concerns without empathy or sensitivity. Then the FFT President refuses to take questions at a presser. An own goal,"" wrote former Australian tennis official Richard Ings.
Osaka earned US$55.2 million (S$72.9 million) over the past 12 months according to sports business website Sportico, much of it from sponsorship deals with major companies in Japan and the United States.
""Above everything else, we wish for Ms Naomi Osaka's quickest recovery and hope she will continue to perform well,"" Japanese sponsor Nissin Foods said in a statement.
More on this topic
Sporting Life: Naomi Osaka's silent stance raises multiple questions
Tennis: Osaka wants to use media boycott 'to bring about change', says coach",,TRUE
Mum's suicide with newborn baby reminder of danger of postpartum depression: Coroner,https://www.straitstimes.com/singapore/courts-crime/mums-suicide-with-newborn-baby-reminder-of-danger-of-postpartum-depression,"SINGAPORE - In a final voice message to her husband left on her mobile phone, a mother of two said that she was not a good mother and had let her family down.
The woman, 35, who had given birth to a baby girl five weeks earlier, added that her mind was not working and she had no idea what she was doing.
In October last year, she and her newborn daughter were pronounced dead at the foot of a housing unit block.
State Coroner Kamala Ponnampalam said in her findings made available on Friday (May 28) that the mother's death served as ""yet another stark reminder of the devastating effects of postpartum depression"".
The coroner ruled the mother's death a suicide and said she had ""tragically perpetrated the unlawful killing of her infant daughter"".
The court heard that the woman was an account executive on maternity leave at the time of her death. She also had a four-year-old daughter.
At about 5pm on Oct 29 last year, a passer-by heard a loud thud coming from the back of the block and saw the baby lying on the ground. He then heard another loud thud and saw the mother on the ground.
He had not heard any commotion before this and called the police immediately.
The duo were pronounced dead at the scene by paramedics and their cause of death was later determined to be multiple injuries consistent with a fall from height.
After the police were called, they found a mobile phone in the family's unit on the 10th floor. It contained a voice recording.
Her husband said the couple had a nanny after the baby was born last September, for the duration of the mother's confinement period.
Five days after the end of that period, the woman told her husband that she was stressed over having to take care of her two children and that she had forgotten how to do it.
He reassured her and said that he and his mother would take care of their elder daughter, and that she only had to rest and take care of the baby.
During her pregnancy, his wife had also expressed concerns about having to go back to work after her maternity leave.
After having the baby, she told him she wanted to quit her job. Her husband advised her to rest during her maternity leave and not think about work.
Her colleague and friend recalled her saying she did not know how to take care of babies any more and suspected she was suffering from postnatal depression, but added that she never expressed a desire to commit suicide.
More on this topic
Don't be afraid to ask for help, says mother who contemplated suicide
Spike in calls to suicide prevention agency SOS in 2020 as more in distress amid Covid-19
In the voice message the woman left for her husband, she said that they should not have had the baby as she did not know how to take care of babies or their family.
Her mind was not working, she had no idea what she was doing, she was not a good mother and wife and had let them down, she added.
She asked her husband to take good care of their elder daughter and expressed regret that she would not be around to watch her grow up.
The woman concluded the message by saying that there was no other way as her mind was not working.
The state coroner said in her findings: ""(The woman's) husband responded by reassuring her and making some alternative care arrangements for their older child. Unfortunately, (her) concerns and anxiety persisted.""
She added that the pressures of caring for a newborn can be immense, with demands from managing the household and family while getting ready to return to work seemingly insurmountable.
It is important that new mothers and those around them understand the enormity of the stress, said the state coroner.
""Most of all, a good support network and genuine encouragement from family and friends are essential to help the new mum cope.""
More on this topic
Mental health advocate sets up charity to guide community in suicide prevention
More needed help during Covid-19 pandemic, say mental health experts
Helplines
Samaritans of Singapore: 1800 221-4444 (24 hours)
Institute of Mental Health: 6389-2222 (24 hours)
Singapore Association for Mental Health: 1800 283-7019 (Mon to Fri, 9am to 6pm)
TOUCHline: 1800 377-2252 (Mon to Fri, 9am to 6pm)",Jean Iau,TRUE
Voices of youth: Let students take days off to improve mental well-being,https://www.straitstimes.com/opinion/forum/voices-of-youth-let-students-take-days-off-to-improve-mental-well-being,"According to a 2016 survey by the Institute of Mental Health, one in seven people in Singapore has experienced a mental health disorder.
With more students facing stress and anxiety, the Ministry of Education should take action and prioritise students' mental health over academic performance.
Students should be offered mental health days to better their mental well-being. These are days when they can be excused from school, similar to when they are sick.
When feeling extremely stressed, anxious and overwhelmed at a level that hinders them from concentrating, they should be entitled to take a day off from school.
Students can take a break from their hectic school lives and engage in activities to boost their physical and mental wellness.
Missing curriculum time is likely to raise concerns about students falling behind in school work.
However, students can catch up by arranging consultations with their teachers when they return to school.
I believe that, in the long run, mental health days would be beneficial to students in helping them cope both mentally and academically.
Furthermore, it teaches students the importance of taking care of their mental health, which reduces stress and burnout.
Mental health is just as important as physical health.
Through mental health days, schools will raise more awareness and show more support for those struggling with their mental health.
Kimberly Kwok, 16
Secondary 4 student",,TRUE
"Tennis: Naomi Osaka fined US$15,000 after win, warned of French Open expulsion",https://www.straitstimes.com/sport/tennis/tennis-osaka-fined-for-media-boycott-could-face-expulsion-from-french-open,"PARIS (REUTERS) – Naomi Osaka was fined US$15,000 (S$28,000) by Grand Slam organisers for skipping a news conference following her first-round win at the French Open on Sunday (May 30), and was also warned of possible expulsion from Roland Garros and future majors if she fails to meet her media commitments.
In the run up to the claycourt major, the world number two announced she would boycott news conferences while in Paris to raise awareness of players’ mental well-being, saying the nature of questions from journalists is like “kicking a person when they are down”.
Osaka started her French Open campaign with a 6-4 7-6(4) win over Romanian Patricia Maria Tig and then snubbed the post-match news conference, although the four-time Grand Slam champion did hold a court-side interview immediately after the contest.
The board of the four Grand Slams said in a statement on Sunday that the French Open organisers had asked Osaka to reconsider her position and tried unsuccessfully to speak with her to resolve the matter.
“The Australian Open, Roland Garros, Wimbledon and the US Open jointly wrote to her to check on her well-being and offer support, underline their commitment to all athletes’ well-being and suggest dialogue,” the statement read.
“She was also reminded of her obligations, the consequences of not meeting them and that rules should equally apply to all players.
“Naomi Osaka today chose not to honour her contractual media obligations. The Roland Garros referee has therefore issued her a $15,000 fine.”
Osaka’s management did not immediately respond to a request for comment but the player published a cryptic message on Twitter.
“Anger is a lack of understanding. Change makes people uncomfortable,” she wrote.
anger is a lack of understanding. change makes people uncomfortable.
— NaomiOsaka大坂なおみ (@naomiosaka) May 30, 2021
The 23-year-old Japanese player, who lives in Florida, has never made it past the third round at Roland Garros and arrived in Paris having played only three matches on clay this season after early defeats in Madrid and Rome.
Osaka, who according to sports business website Sportico earned US$55.2 million over the past 12 months, has previously used her platform and considerable media attention to highlight issues of police violence and racial inequality.
Media duty
While announcing her decision on Twitter to boycott news conferences she said she hoped the “considerable amount” that she expected to forfeit as fines would go towards a mental health charity.
Rafa Nadal, a 20-times Grand Slam winner, and women’s world number one Ash Barty have said they believe players have a duty to address the media.
Seven-time Grand Slam singles champion Mats Wilander said on Sunday that Osaka should not play tournament tennis until she is ready to take part in post-match news conferences.
“We have advised Naomi Osaka that should she continue to ignore her media obligations during the tournament, she would be exposing herself to possible further Code of Conduct infringement consequences,” the board of the four Grand Slams added.
More on this topic
Tennis: Naomi Osaka to boycott media at French Open 'for mental health'
Tennis: Osaka finds support after decision to skip press at French Open
“As might be expected, repeat violations attract tougher sanctions including default from the tournament ... and the trigger of a major offence investigation that could lead to more substantial fines and future Grand Slam suspensions.” The board said it would be unfair to other players if Osaka refuses to face the press while others honour their commitments.
“We will see how everything will end up,” two-time Wimbledon winner Petra Kvitova said after her win in the opening round. “But me personally, I was always trying to follow the rules and be fair not only on the court but off the court as well. Now it’s up to them to decide what’s going to be.”
Osaka showed no signs of being distracted by the issue during her opening match on a sun-bathed Philippe Chatrier court, however.
Asked in her courtside interview about how she adapts her game to the surface, Osaka said: “It’s a work in progress. Hopefully the more I play the better I play.” “I’m really glad that I won. It’s a beautiful court. I’ve only played two matches here (on Philippe Chatrier), one before the roof and one now, so hopefully I’ll keep it going.”
More on this topic
Tennis: Osaka lets racket do talking at French Open
Osaka, who missed last year’s tournament due to a hamstring problem, was not keen on engaging in long rallies and seemed too powerful against the 63rd-ranked Tig.
She stamped her authority on the match early with a 5-2 lead but needed a second break of serve after the Romanian staged a late fightback.
Tig saved a break point and a match point to take the second set into a tiebreaker before Osaka sealed it with a backhand winner to set up a second round meeting with another Romanian in Ana Bogdan.",,TRUE
Tennis: Osaka lets racket do talking at French Open,https://www.straitstimes.com/sport/tennis/tennis-osaka-lets-racket-do-talking-at-french-open,"PARIS (AFP) - World No. 2 Naomi Osaka let her racket do the talking at the French Open on Sunday (May 30) when she reached the second round with a 6-4, 7-6 (7-4) victory over Romania's Patricia Maria Tig.
The 23-year-old Japanese star, a four-time Grand Slam champion, has refused to carry out media obligations at the tournament, claiming news conferences are detrimental to her mental health.
Osaka, who has never got past the third round in Paris, fired 39 winners but committed 35 unforced errors against her 63rd-ranked opponent.
Next up for the second seed is another Romanian player, Ana Bogdan.
More on this topic
Tennis: Osaka finds support after decision to skip press at French Open
Tennis: Nadal, Osaka win top Laureus sports awards",,TRUE
Schizophrenia - looking beyond the symptoms,https://www.straitstimes.com/opinion/schizophrenia-looking-beyond-the-symptoms,"In his book Far From The Tree: Parents, Children, And The Search For Identity, Professor Andrew Solomon draws a parallel between schizophrenia and Alzheimer's disease.
He wrote that schizophrenia is ""an illness not of accrual but of replacement and deletion; rather than obscuring the previously known person, this disease to some degree eliminates that person"".
Please subscribe or log in to continue reading the full article.
Get unlimited access to all stories at $0.99/month
Latest headlines and exclusive stories
In-depth analyses and award-winning multimedia content
Get access to all with our no-contract promotional package at only $0.99/month for the first 3 months*
Subscribe Now
*Terms and conditions apply",Chong Siow Ann,TRUE
My experience with schizophrenia - as patient and researcher,https://www.straitstimes.com/opinion/my-experience-with-schizophrenia-as-patient-and-researcher,"One of my worst memories is being seated on a wheelchair at the emergency room of the Institute of Mental Health (IMH).
I was 25 years old and floridly psychotic. There is never a convenient time to fall sick, but I count myself lucky to be surrounded by my loved ones and had access to quality mental healthcare services when I did eight years ago.
Please subscribe or log in to continue reading the full article.
Get unlimited access to all stories at $0.99/month
Latest headlines and exclusive stories
In-depth analyses and award-winning multimedia content
Get access to all with our no-contract promotional package at only $0.99/month for the first 3 months*
Subscribe Now
*Terms and conditions apply",,TRUE
