Article_Headline,Article_url,Article_content,Article_Author,COVID Related?
"Amid pandemic yoga boom, more eye yoga teaching as side gig",https://www.straitstimes.com/life/amid-pandemic-yoga-boom-more-eye-yoga-teaching-as-side-gig,"SINGAPORE - Before the pandemic, musician Eugene Seow was playing at weddings, corporate events and bars six to seven times a week.
When he was not performing, the multi-instrumentalist taught music privately and at international schools.
Please subscribe or log in to continue reading the full article.
Get unlimited access to all stories at $0.99/month
Latest headlines and exclusive stories
In-depth analyses and award-winning multimedia content
Get access to all with our no-contract promotional package at only $0.99/month for the first 3 months*
Subscribe Now
*Terms and conditions apply",Amanda Chai,TRUE
Blackstone invests in mental health app at US$1 billion valuation,https://www.straitstimes.com/business/companies-markets/blackstone-invests-in-mental-health-app-at-us1-billion-valuation,"SAN FREANCISCO (BLOOMBERG) - Blackstone Group is leading a US$100 million (S$134.6 million) funding round in on-demand mental-health company Ginger, accelerating a push into fast-growing technology start-ups.
The funds will come out of the investment firm's growth equity arm, Blackstone and Ginger said. The stake values the San Francisco-based service at about US$1 billion, vaulting it to unicorn status.
Demand for resources provided by Ginger, which connects users to behavioural health experts via a mobile app, is surging amid the Covid-19 pandemic. The company's revenue has tripled in the past year.
""There's a widespread prevalence of mental health issues in this country,"" said Mr Ram Jagannath, who heads healthcare investing for Blackstone Growth Equity. ""Like other sectors of healthcare, the pandemic exacerbated the underlying trends and accelerated people's adoption of digital platforms.""
Blackstone recently announced the final close of its first growth equity fund at US$4.5 billion. Its New York-based growth vehicle has made several investments, including backing online dating company Bumble prior to its initial public offering, vegan food products maker Oatly, enterprise software provider ISN Software Corp and Epidemic Sound, a royalty-free music company.
Ginger chief executive Russ Glass plans to use Blackstone's investment to acquire companies and platforms focused on mental health, or data that could complement what Ginger is already doing.
""There's going to be a massive mental health need for the foreseeable future,"" Mr Glass said in an interview. ""The more we can focus on innovation, everyone who has a need will get access.""
Statistics bear that out. During the week of March 8, demand for therapy and psychiatry services jumped 365 per cent compared with pre-pandemic averages measured from August 2019 to January last year, the company said.
In the first half of the year, Ginger plans to extend its reach to underserved populations through new government relationships and collaborations with non-profits, Mr Glass said.
Ginger has already made inroads with large brand-name companies - including Delta Air Lines, Sanofi and Domino's Pizza - which provide Ginger's mental health resources to their employees.
In August, Ginger raised US$50 million from investors including Advance Venture Partners and Bessemer Venture Partners. Earlier this month, former Massachusetts representative Joe Kennedy III and cyber-security executive Myrna Soto joined its advisory board. Ginger has also announced a partnership with digital pharmacy Capsule to provide medication delivery to members.
""I see this as an investment, not a cost,"" said Mr Clint Wallace, the head of human resources for North America at Sanofi. ""We can't solve all of people's problems but we can help them give their best.""
More on this topic
Blackstone rolls the dice with $8.3b move on Australia’s Crown Resorts
Blackstone seeking at least $6.7 billion for second Asia fund",,TRUE
"To maintain feelings of happiness, you need to work on it a bit",https://www.straitstimes.com/life/to-maintain-feelings-of-happiness-you-need-to-work-on-it-a-bit,"SINGAPORE - The birds are chirping, a warm breeze is blowing and some of your friends are getting vaccinated.
After a year of anxiety and stress, many people are finally rediscovering what optimism feels like. But if you are expecting your happiness to skyrocket the moment the world finishes off this pandemic once and for all, think again.
Yes, receiving your vaccine shot, daydreaming about intimate dinner parties or first hugs with grandchildren may give you a jolt of joy - but euphoria, unfortunately, tends to be fleeting.
Blame ""hedonic adaptation"", says Dr Rhea Owens, an associate professor of psychology at the University of Minnesota Duluth, who conducts research on positive psychology interventions in counselling practices.
When good or bad things happen, people feel an initial surge or dip in their overall happiness levels.
Hedonic adaptation means that, over time, they settle back into wherever they were happiness-wise before that good or bad event happened, even if the good thing - such as getting your dream job - is continuing.
To maintain those positive feelings, you are going to need to work on it a bit. Thank evolution.
""Our brains developed biologically for survival, not happiness,"" says Dr Sanjay Kumar, director of contemplative practices and well-being at the Fish Interfaith Center at Chapman University in Orange, California.
The human mind, he adds, ""prioritises negative experiences to be remembered more strongly than positive ones, as a way for us to anticipate potential threats in our environment"".
While that is good for evolution, excessive worry is not anyone's idea of a happy state of mind.
Ultimately, happiness is more of a daily practice than anything else, Dr Kumar says. This is why getting your coronavirus shot may make you happy for a moment, but will not bring long-term happiness.
The good news is that researchers have found steps that will - and no needles are required. These strategies work perfectly in a moment like this - when hope is on the horizon, but the path towards it is not yet clear.
It is okay to not yet be okay
While many are beginning to exhale, others are still buried deep in grief.
If that sounds like you, it is acceptable if this stage of the pandemic does not feel joyous, says psychologist Shannon South, who is based in North Carolina.
If you need to avoid pictures of your friends getting their coronavirus vaccines on social media, that is fine.
Consider this your permission to let yourself feel what you need to feel.
More on this topic
Over 3 million people signed up for Yale's happiness course
How to be happier at work
Savour everything
For some, their first time hugging friends in a year is going to be a moment to savour.
But there is joy in everyday things too.
Even mundane things - such as watching yet another youth football game - can feel special if you take a moment to remember the not-so-distant past when so much of life was put on hold.
Dr Owens recommends taking the time whenever something good happens - no matter how small - to really acknowledge it.
Marvel as much as you can
In the past decade, researchers have been investigating the relationship between wonder, happiness and good health.
In 2013, the Social Interaction Laboratory at the University of California, Berkeley, started Project Awe to study the intersection of awe and happiness.
In one study published in the journal Emotion in 2015, participants who experienced more positive emotions had lower levels of interleukin-6, a marker for inflammation. And participants with the lowest levels of interleukin-6 were those who reported feeling awe most often.
More on this topic
Can money buy happiness?
Don't be afraid to ask for help, says mother who contemplated suicide
Perhaps this explains why getting the vaccine is such a serotonin boost for so many. Not only do you feel like the future is brighter, but you may also feel awe at the wonders of modern science.
The feeling of awe can also come from a walk around the block, says The Awe Factor author Allen Klein.
One of his favourite strategies for ensuring his daily dose of awe is heading out for an ""awe walk"".
On these strolls, he switches off his mental list of chores and things to remember, and instead focuses on finding wonder in small things along the way.
Be grateful and kind
Acts of kindness tend to increase people's ratings of their own happiness, Dr Owens says.
You may also get some benefit from simply thinking about good deeds you have done.
A study this year - published in The Journal of Positive Psychology by researchers at the University of California, Riverside - found that reflecting on past kind deeds improved well-being at a rate similar to actually going out and doing new good deeds.
Realise happiness alone is not enough
If you have been struggling with depression throughout the pandemic, working to boost your own happiness may not be a cure.
""The opposite of depression is not happiness,"" says New York-based psychiatrist Jeff Ditzell. ""The opposite of depression is no longer being depressed.""
If you have had symptoms of depression these past 12 months, you may feel your depression subside as the pandemic slowly wanes.
But on the other hand, it may not. Clinical depression should be treated by a mental health professional.
Break out your calendar
While it is still uncertain when big parties and other activities people enjoyed before the pandemic will return, scheduling a few safe activities can do wonders for keeping your optimism up.
In fact, just anticipating an event can sometimes be as pleasurable as the activity itself.
Perhaps it is too early to set a date for a 15-person dinner party, but you can crack open a cookbook to start planning the menu.
And when party day arrives, remember to savour every last morsel and belly laugh, as you eat, drink and be more than just fleetingly merry.",,TRUE
KKH psychologists share child trauma warning signs as cases rise 30%,https://www.straitstimes.com/singapore/health/amid-30-per-cent-rise-in-child-trauma-referrals-at-kkh-psychologists-share-warning,"SINGAPORE - The number of child trauma referrals at the KK Women's and Children's Hospital (KKH) has risen by about 30 per cent since 2017, with 210 last year.
Such children may have experienced a wide variety of traumatic events, such as road traffic accidents, sexual abuse, bullying, physical assaults, family violence and loss of a loved one.
Please subscribe or log in to continue reading the full article.
Get unlimited access to all stories at $0.99/month
Latest headlines and exclusive stories
In-depth analyses and award-winning multimedia content
Get access to all with our no-contract promotional package at only $0.99/month for the first 3 months*
Subscribe Now
*Terms and conditions apply",Timothy Goh,TRUE
On the scent of a good night's sleep,https://www.straitstimes.com/life/home-design/on-the-scent-of-a-good-nights-sleep,"SINGAPORE - Ms Maybelle Sua, founder of six-year-old local online clothing brand Neonmello, turned to an aromatherapist last year when she developed pandemic-induced insomnia.
""I faced challenges every day because of business uncertainties,"" says the 32-year-old. ""It got harder and harder to fall asleep during those difficult times.""
Please subscribe or log in to continue reading the full article.
Get unlimited access to all stories at $0.99/month
Latest headlines and exclusive stories
In-depth analyses and award-winning multimedia content
Get access to all with our no-contract promotional package at only $0.99/month for the first 3 months*
Subscribe Now
*Terms and conditions apply",Chantal Sajan,TRUE
Over 3 million people signed up for Yale's happiness course,https://www.straitstimes.com/life/over-3-million-people-signed-up-for-yales-happiness-course,"NEW YORK (NYTIMES) - The Yale happiness class, formally known as Psyc 157: Psychology and the Good Life, is one of the most popular classes to be offered in the university's 320-year history.
The class was only ever taught in-person once, during the spring 2018 semester, as a 1,200-person lecture course in the largest space on campus.
That March, a free 10-week version made available to the public via Coursera, titled The Science Of Well-Being, also became instantly popular, attracting hundreds of thousands of online learners.
But when lockdowns began last March, two full years later, the enrolment numbers skyrocketed. To date, over 3.3 million people have signed up, according to the website.
""We octupled the number of people taking the class,"" said Dr Laurie Santos, a professor of psychology at Yale and the head of the university's Silliman College, of its pandemic-era popularity.
""Everyone knows what they need to do to protect their physical health: wash your hands and social distance and wear a mask,"" she added. ""People were struggling with what to do to protect their mental health.""
The Coursera curriculum, adapted from the one Dr Santos taught at Yale, asks students to, among other things, track their sleep patterns, keep a gratitude journal, perform random acts of kindness, and take note of whether, over time, these behaviours correlate with a positive change in their general mood.
Ms Gretchen McIntire, 34, a home health aide in Massachusetts, is studying for her bachelor's degree in psychology through an online programme from Southern New Hampshire University.
In her free time during the lockdown in August, Ms McIntire took the class. She called it ""life-changing"".
The practical aspect of the Coursera curriculum appealed to Ms McIntire, who learnt she had Asperger's syndrome at 23. A night owl, she had struggled with sleep and on enforcing her own time boundaries.
""It's hard to set those boundaries with yourself sometimes and say, 'I know this book is really exciting, but it can wait till tomorrow, sleep is more important,'"" she said.
""That's discipline, right? But I had never done it in that way, where it's like, 'It's going to make you happier. It's not just good for you; it's going to actually legitimately make you happier.'""
She said she found having a daily meditation practice helpful and has stuck with it even after finishing the class. Meditation also helped her to get off social media.
""I found myself looking inward. It helped me become more introspective,"" she said. ""Honestly, it was the best thing I ever did.""
She later re-downloaded her social apps, including Facebook Messenger, and felt instantly overwhelmed.
Dr Laurie Santos (left) talks with students after a session of her class at Yale University in New Haven, US, on Jan 25, 2018. PHOTO: NYTIMES
Ms Tracy Morgan, a programming supervisor at the Bob Snodgrass Recreation Complex in High River in Alberta, Canada, signed up for the class last June as she was in lockdown with her children and husband.
""There's no reason I shouldn't be happy,"" she said. ""I have a wonderful marriage. I have two kids. I have a nice job and a nice house. And I just could never find happiness.""
Since taking the course, Ms Morgan, 52, has made a commitment to do three things every day: practise yoga for one hour, take a walk outside in nature no matter how cold it may be in Alberta, and write three to five entries in her gratitude journal before bed.
""When you start writing down those things at the end of the day, you think about it only at the end of the day, but once you make it a routine, you start to think about it all throughout the day,"" she said.
And some studies show that finding reasons to be grateful can increase your general sense of well-being.
More on this topic
How to be happier at work
Can money buy happiness?
Dr Ewa Szypula, 37, a lecturer of French studies at the University of Nottingham in Britain, said she has been interested in self-improvement techniques since studying for her PhD several years ago.
""Somewhere along the second or third year, you do feel a bit burned out, and you need strategies for dealing with it,"" she said.
One small study from Dr Santos' curriculum that stuck with her involved polling 632 Americans to predict how happy they would be if they were given US$5 (S$6.70) to spend on themselves versus getting US$5 and being told they must spend it on someone else.
In the study, people predicted that they would be happier if they were allowed to keep the money. But participants consistently reported afterward that they had in fact derived more satisfaction from spending money on someone.
Dr Szypula had the opportunity to combine her newfound knowledge in a practical experiment on her sister's birthday. Instead of keeping an expensive dress she had bought, she gave it to her sister.
More on this topic
More needed help during Covid-19 pandemic, say mental health experts
Covid-19 will have a long-tail effect on mental health, experts predict
""I'm still feeling that happiness months later,"" she said.
Not every student of the class has felt transformed.
Mr Matt Nadel, 21, a Yale senior, was among the 1,200 students taking the class on campus in 2018. He said the rigours of Yale were a big adjustment when he started at the university in the autumn of 2017.
""I was stressed, and I didn't know exactly how to manage that,"" he said.
Mr Nadel said he was disappointed that the class was a sort of review of the kinds of obvious good advice you may get from a grandmother: Get enough sleep, drink enough water, just do your best.
""I knew that sleeping was good. I knew that my grades didn't matter for long-term happiness, that I wasn't going to be a happier, better person because of having good grades,"" he said. ""Did the class impact my life in a long term, tangible way? The answer is no.""
While the class was not life-changing for him, Mr Nadel said that he is more expressive now when he feels gratitude.
""Which is great,"" he said. ""But that's about all.""",,TRUE
National Council of Social Service launches guide for media reporting on mental health issues,https://www.straitstimes.com/singapore/health/national-council-of-social-service-launches-guide-for-media-reporting-on-mental,"SINGAPORE - As part of efforts to address the stigma associated with mental health conditions, the National Council of Social Service (NCSS) on Tuesday (March 16) launched a guide with words and phrases that should be avoided when reporting on the issue.
For example, the phrase ""someone with a mental health condition"" is preferred over terms such as ""mentally ill"", ""psycho"", ""mad"" or ""crazy"".
Aside from stigmatising terms and their suggested alternatives, the Beyond the Label Media Guide contains suggestions on how people with mental health conditions should be interviewed, as well as angling and headlining stories, and reporting on violence and suicides.
The guide was developed in consultation with social service agencies, mental health professionals, persons with mental health conditions and members of local media.
Ms Anita Fam, president of NCSS, said the guide provides recommendations for media professionals reporting on mental health issues or writing about incidents involving persons with mental health conditions.
""We believe that the media is and can be instrumental in influencing and changing attitudes and behaviour, educating and encouraging people to think differently about mental health, and to be aware of the problem of stigma associated with mental health conditions,"" added Ms Fam.
The guide follows work NCSS did in 2018, when it launched the first nationwide mental health anti-stigma campaign ""Beyond the Label"".
It was aimed at correcting misperceptions, raising awareness and promoting greater social inclusion of people in recovery from mental health conditions.
The issue was also addressed earlier this month when Dr Janil Puthucheary, Senior Minister of State for Health and Communications and Information, said during the debate on the Health Ministry's budget last week that the Covid-19 mental health task force would be transformed into an inter-agency platform to oversee mental health and well-being efforts beyond the pandemic.
The guide was introduced after a study by NCSS and the Singapore Management University showed that about 40 per cent of articles about mental health were crime-related.
NCSS said this may give the public cause to link mental illness with crime. In contrast, the study found that only about 15 per cent of articles highlighted care, prevention and recovery.
The study had examined 2,000 local media articles from 2016 to 2019.
In addition, the study found that stigmatising phrases such as ""mentally ill"" were used, especially in the headlines of articles.
Ms Porsche Poh, executive director of Silver Ribbon (Singapore), said: ""You don't say a person with skin problem or cancer was caught for attacking someone. If you don't mention a physical illness why mention a mental illness?""
Silver Ribbon is a non-profit organisation dedicated to combating mental health stigma and helping those with mental health conditions integrate into society.
More on this topic
More needed help during Covid-19 pandemic, say mental health experts
Mental health advocate sets up charity to guide community in suicide prevention
She said positive reports on mental health may encourage people with such conditions to see that they can lead a productive life.
In the book's foreword, editor-at-large of The Straits Times Han Fook Kwang said stories that stigmatise people result in readers no longer looking for the whys and hows behind an incident, as they have already formed their own stereotyped views.
""I learnt much from this guide and wished it was available when I was in the newsroom. It pains me to think of the number of times we might have fallen short.
""Looking back, I think we were largely ignorant and did not know our work could have such a stigmatising effect. This guide should help journalists do better,"" added Mr Han.
More on this topic
SOS launches text-based suicide prevention service, appeals for more volunteers
Covid-19 mental wellness task force will look into post-pandemic needs, develop strategy",Timothy Goh,TRUE
