,subreddit,subreddit_subscribers,title,id,author,created_utc,num_comments,score,selftext,url,upvote_ratio,comments
4,singapore,135573,Chronic illness leaving me homebound. Advice.,9ju15v,bloo1122,1538197749,16,6,"Throw away account for privacy reasons.

I am here looking for any advice on financial schemes or work from home jobs. I am currently running a small leather business that help keeps my head above water thus far. Will take any help or advice to how am I going to continue living this life.

I’m currently 22 diagnosed with a chronic illness, Irritable Bowel Syndrome (IBS), that changed my life forever. From having a full time job, to being left homebound. The severity of IBS varies and sadly mine is on the severe end.

The problem is getting a job that allows me to work from home. The fact that I was diagnosed with anxiety disorder &amp; depression seven years ago, my future is looking bleak. 

Please do not give me advice on medication as I have tried almost everything and have spend all my resources on it.",https://www.reddit.com/r/singapore/comments/9ju15v/chronic_illness_leaving_me_homebound_advice/,0.0,"['IBS for me as well, but nowhere near severe. I don’t have much for you, maybe you can post more information on your qualifications and skillset? I’m sure you can fit in somewhere.\n\nDoctors have told me to go with low fodmap diet, not sure if it works for you. Stay strong man.']"
5,singapore,141833,"A very good example of why we shouldn't have kids. As proven, your environment will affect your mood. Messy places causes you to be unstable and easily irritable which will affect your mood and your work. What are your views?",9wyp5c,PewPaw-Grams,1542188806,15,1,,https://i.redd.it/37c36g8lp9y11.jpg,0.0,"[""you've talked about this a month or two before right? ""]"
6,singapore,140810,Probiotics sold in Singapore (need recommendations),9uw9es,maileymamemo,1541565631,16,1,"Hello everyone,

I’m keen on taking probiotics supplements for my gut health and also because of suspected irritable bowel syndrome. 

Do anyone have any experiences on what is a good brand that is sold in Singapore? There’s a lot of brands and I’m not sure what would be good. Prefer something that I can buy at Guardian/ pharmacy etc 

Thank you kindly ",https://www.reddit.com/r/singapore/comments/9uw9es/probiotics_sold_in_singapore_need_recommendations/,0.0,['[i take this] (https://sg.iherb.com/pr/california-gold-nutrition-lactobif-probiotics-30-billion-cfu-60-veggie-caps/64009)']
7,singapore,0,Where can a student get help for depression?,78ue66,PossibleDepression2,1509009529,13,8,"Hi there. I've been feeling down lately mainly due to university, and I've become more and more stressed out. I've also become more irritable, and I've noticed that I'm eating only once a day on some days. Severely negative thoughts began forming since end of March, and got better during summer holiday (June-July). However, it got worse than before since September due to a year-long college research project that seems to be failing. And it doesn't help that my neighbors are noisy even at night, especially the person living in the unit in front of me. Whenever that neighbor comes to his unit, I can't help but to feel distressed and uneasy. I've tried multiple times talking to him to keep his voice level down, and every time he keeps on commenting that it's not his fault that I can't stand him and it's a consequence of living in a flat.

---

I decided to do some online depression/anxiety quizzes you can find online and found out that I am almost definitely suffering from a high level of depression, and moderate-high anxiety. The sites I used are: from whatsmym3, 7Cups, NHS, and a couple of other sites which I have forgotten.

---

And to the people here, I hope you don't mind answering some questions:

- To people familiar with the premise of depression/anxiety, are those online tests to be trusted?

- To people who had suffered/are currently suffering depression, what small things can someone do to to maintain emotional wellness? When is it appropriate to seek a professional, and what kind of professional should you see (e.g. psychiatrist, psychologists, therapists, etc)?

- Where in Singapore can a student have himself mentally diagnosed for cheap?

---

Thank you, and I hope you have a nice day.",https://www.reddit.com/r/singapore/comments/78ue66/where_can_a_student_get_help_for_depression/,0.0,"['Online tests are ok to diagnose imo. \n\nFor me I have severe depression and anxiety, and I go to a government hospital for medicine and psychotherapy. To get the subsidy, go to any polyclinic, explain your situation and then ask for a referral letter - the doctor in the polyclinic will ask you which hospital you prefer for your convenience.\nThe subsidy is usually at least half of the total bill, so it is still an ok amount. Medicine wise, they will try to give you the medicines that the government subsidies so that you don’t have to pay a lot.\n\nFor depression, remember to not ruminate in your thoughts and coop yourself up at home/in your room - whenever you have a depressive episode/start to feel depressed, go out and eat some fresh air. You don’t have to exercise, you can just go out and surround yourself with people and try not to be alone as much as you can.\n\nI’m sorry I don’t really remember your questions (typing from a phone) and if you have any questions that you want to ask or if you need a hearing ear, feel free to PM me! Please stay safe! ']"
0,NationalServiceSG,4582,Down PES Question - I have Irritable bowel syndrome (IBS),iwx2u0,LargeYesterday1904,1600680195,7,1,"I am enlisting next week but earlier today, I went to the doctor and I need to be referred to a specialist because of conditions related to my intestines, mainly Irritable Bowel Syndrome (IBS). 

I will still report on the day itself and everything but I was thinking if after I see the specialist and give my medical officer the memo, will I be able to down pes afterwards? It might be possible I need long term medication...

Should I go through the Medical Officer to get a specialist appointment if they can do so? I also wonder if SAF can cover that expense as well since I also need to tell my platoon commander that I need financial assistance.

Anyone else has had  Irritable Bowel Syndrome (IBS) while serving in the SAF? What was your experience?",https://www.reddit.com/r/NationalServiceSG/comments/iwx2u0/down_pes_question_i_have_irritable_bowel_syndrome/,1.0,['i think you should go to cmpb asap and report to the MO there']
1,NationalServiceSG,1320,about PES,eijb1d,john9946,1577891605,4,1,"During 2018 I went to my pre enlistees medical check up and I only had a few small problems and I told them about it 

Around 2019 a lot of my small medical problems became bigger and bigger 
I have seen a few specialist about different symptoms and they all have told me I have this I have that but I never asked them for a medical diagnosis 

Currently I Suffer from Irritable bowel syndrome , Chronic  Tension headache and Migraines

Basically I have constipation &amp; diarrhea on and off and the whole day I have stomach pains and headache for the whole day till night sometimes I need pain killers just to sleep All my medicine only help to lessen the pain but sometimes it’s unbearable and I need to sleep the whole day 

My Doctors all just give me medicine and tell me to test if it works. They always tell me THEY think it’s this        But now I’m in a state of panic because I don’t know if they put my conditions into the system since they always say they THINK 

I don’t know if I can live through ns with unbearable headaches and Stomach Pains 24/7. 
I’m Currently PES B4 ( They don’t know about all of these new symptoms) 
I don’t know how to get my medical documents",https://www.reddit.com/r/NationalServiceSG/comments/eijb1d/about_pes/,0.0,['I’m curious about how you have constipation and diarrhoea at the same time?']
